{
  "schema_version": "1.2.0",
  "metadata": {
    "generated_by": "guardians-of-the-claude",
    "last_updated": "2026-04-14T00:00:00Z",
    "source_files_checked": ["package.json"]
  },
  "runtime_and_language": {
    "runtime": "Node.js",
    "language": null,
    "module_system": null
  },
  "framework_and_libraries": {
    "framework": "Next.js 15",
    "ui": "React 19",
    "styling": null
  },
  "package_management": {
    "manager": "npm",
    "lock_file": null
  },
  "testing": {
    "unit": null,
    "e2e": null
  },
  "build_and_dev": {
    "bundler": null,
    "linter": null,
    "formatter": null
  },
  "project_structure": {
    "type": "single_project",
    "source_convention": null,
    "key_directories": []
  },
  "claude_code_configuration_state": {
    "model": "claude-opus-4-7",
    "scoring_model_ack": {
      "version": "audit-score-v4.1.0",
      "seen_count": 0
    },
    "claude_md": { "exists": true, "section_count": 5 },
    "settings_json": { "exists": true, "has_permissions": true },
    "rules_count": 0,
    "agents_count": 0,
    "hooks_count": 0,
    "mcp_servers_count": 0
  }
}
